{
  "channel": "stable",
  "generation": 13,
  "previous_release_id": "2026-08-07-002",
  "release_id": "2026-08-12-001",
  "release_manifest_sha256": "bbd5031f155e52910382e1c137edd72c6b17698d05d3ba83ea61c23a45df9aa6",
  "release_manifest_size": 110383,
  "release_manifest_url": "https://github.com/thedavidweng/openkara-models/releases/download/infra-2026-08-12-001/release-manifest.json",
  "schema_version": "openkara.catalog/channel-v1",
  "updated_at": "2026-08-13T06:30:00Z"
}
